revision;Meta Class;Meta Concept;Meta Description;envisionName;nwName;format;flags;nullTokens;failureKey;failureMapping;nbOccurrences;shotMeta;name_noDot;ecsName;ecsType
1;Reserved;Message;This key is used to capture the raw message that comes into the Log Decoder;msg;msg;Text;Transient;;;;272;internal;msg;rsa.internal.msg;text
1;;;;messageid;;;;;;;270;internal;messageid;rsa.internal.messageid;keyword
1;Time;Event Time;This key is used to capture the time mentioned in a raw session that represents the actual time an event occured in a standard normalized form;event_time;event.time;TimeT;None;;;;253;time;event_time;rsa.time.event_time;keyword
1;Identity;Destination User Account;This key should only be used to capture the Primary/Destination User in the event;username;user.dst;Text;None;none|-;;;248;identity;user_dst;user.name;keyword
1;;;;event_description;event.desc;Text;None;;;;223;internal;event_desc;rsa.internal.event_desc;keyword
1;;;;action;action;Text;None;;;;217;misc;action;rsa.misc.action;keyword
1;Database;Index ID;This key captures IndexID of the index.;info;index;Text;Transient;;;;214;db;index;rsa.db.index;keyword
1;Network;Source IP Address;This key should only be used when it’s a Source IP Address.;saddr;ip.src;IPv4;None;(null)|-;ipv6.src;saddr_v6;209;network;ip_src;source.ip;ip
1;Reserved;Payload Size;This is the size of a payload in a Packet Session. This key should never be used to parse Meta data from a session (Logs/Packets) Directly, this is a Reserved key in NetWitness;payload;payload;UInt32;Transient;;;;206;internal;payload;rsa.internal.payload;integer
1;Miscellaneous;Message;This key captures the contents of instant messages;message;message;Text;Transient;;;;193;internal;message;rsa.internal.message;keyword
1;Network;Hostname Aliases;This key should be used when the source or destination context of a hostname is not clear.Also it captures the Device Hostname. Any Hostname that isnt ad.computer.;hostname;alias.host;Text;None;;;;192;network;alias_host;rsa.network.alias_host;keyword
1;Investigations;Event Activity;This key captures the particular event activity(Ex:Logoff);ec_activity;ec.activity;Text;None;;;;183;investigations;ec_activity;rsa.investigations.ec_activity;keyword
1;Investigations;Event Theme;This key captures the Theme of a particular Event(Ex:Authentication);ec_theme;ec.theme;Text;None;;;;181;investigations;ec_theme;rsa.investigations.ec_theme;keyword
1;Investigations;Event Subject;This key captures the Subject of a particular Event(Ex:User);ec_subject;ec.subject;Text;None;;;;179;investigations;ec_subject;rsa.investigations.ec_subject;keyword
1;Miscellaneous;Result;This key is used to capture the outcome/result string value of an action in a session.;result;result;Text;None;;;;179;misc;result;rsa.misc.result;keyword
1;Miscellaneous;Severity;This key is used to capture the severity given the session;severity;severity;Text;Transient;;;;167;misc;severity;rsa.misc.severity;keyword
1;Investigations;Event Outcome;This key captures the outcome of a particular Event(Ex:Success);ec_outcome;ec.outcome;Text;None;;;;153;investigations;ec_outcome;rsa.investigations.ec_outcome;keyword
1;Network;Destination IP address;This key should only be used when it’s a Destination IP Address.;daddr;ip.dst;IPv4;None;(null)|-;ipv6.dst;daddr_v6;152;network;ip_dst;destination.ip;ip
1;Miscellaneous;Event Type;This key captures the event category type as specified by the event source.;event_type;event.type;Text;None;;;;149;misc;event_type;rsa.misc.event_type;keyword
1;Miscellaneous;Reference ID;This key is used to capture an event id from the session directly;id;reference.id;Text;None;;;;138;misc;reference_id;rsa.misc.reference_id;keyword
1;Network;Protocol;This key should be used to capture the protocol name;protocol;protocol;Text;Transient;;;;133;network;protocol;network.protocol;keyword
1;Miscellaneous;Versions;This key captures Version of the application or OS which is generating the event.;version;version;Text;None;;;;133;misc;version;observer.version;keyword
1;File;Filename;This key is used to capture the complete filename/Webpage with extension where the directionality is not clear. This should not include the directory/path;filename;filename;Text;File;N/A;;;128;file;filename;file.name;keyword
1;;IP Address;Deprecated, use alias.ip;hostip;ip.addr;IPv4;None;(null)|-;ipv6.addr;hostip_v6;128;network;ip_addr;host.ip;ip
1;;IP Source Port;Deprecated, use port.src;sport;ip.srcport;UInt16;Transient;-|(null)|N/A;;;123;network;ip_srcport;source.port;long
1;;Destination Port;Deprecated, use port.dst;dport;ip.dstport;UInt16;None;-|(null)|null|N/A;;;115;network;ip_dstport;destination.port;long
1;Miscellaneous;Disposition;This key captures the The end state of an action.;disposition;disposition;Text;Transient;;;;113;misc;disposition;rsa.misc.disposition;keyword
1;Miscellaneous;Result Code;This key is used to capture the outcome/result numeric value of an action in a session;resultcode;result.code;Text;None;;;;112;misc;result_code;rsa.misc.result_code;keyword
1;Miscellaneous;Category;This key is used to capture the category of an event given by the vendor in the session;category;category;Text;None;;;;105;misc;category;rsa.misc.category;keyword
1;Miscellaneous;Object Name;This is used to capture name of object;obj_name;obj.name;Text;None;;;;102;misc;obj_name;rsa.misc.obj_name;keyword
1;Network;Source Hostname;This key should only be used when it’s a Source Hostname.;shost;host.src;Text;None;;;;99;network;host_src;host.hostname;keyword
1;Miscellaneous;Object Type;This is used to capture type of object;obj_type;obj.type;Text;None;;;;96;misc;obj_type;rsa.misc.obj_type;keyword
1;Web;URL;This key is used for capturing complete url;url;url;Text;Transient;;;;93;web;url;url.original;keyword
1;Miscellaneous;Server Application;This key is used to capture the name of the server application only;application;server;Text;Transient;;;;91;misc;server;network.application;keyword
1;Miscellaneous;Event Source;This key captures Source of the event that’s not a hostname;event_source;event.source;Text;None;;;;90;misc;event_source;rsa.misc.event_source;keyword
1;Network;Service Name;This is used to capture descriptive service name, typically seen in Windows;service;service.name;Text;None;;;;88;network;service_name;service.name;keyword
1;;;;domain;domain;Text;None;;;;84;network;domain;server.domain;keyword
1;Miscellaneous;Event Session ID;This key is used to capture a sessionid from the session directly;sessionid;log.session.id;Text;Transient;;;;82;misc;log_session_id;rsa.misc.log_session_id;keyword
1;Miscellaneous;Group Name;This key captures the Group Name value;group;group;Text;None;;;;81;misc;group;rsa.misc.group;keyword
1;Network;Destination Hostname;This key should only be used when it’s a Destination Hostname;dhost;host.dst;Text;None;;;;81;network;host_dst;rsa.network.host_dst;keyword
1;Counters;Device class Counter 1;This is a generic counter key that should be used with the label dclass.c1.str only;dclass_counter1;dclass.c1;Int32;Transient;;;;80;counters;dclass_c1;rsa.counters.dclass_c1;integer
1;Miscellaneous;Policy Name;This key is used to capture the Policy Name only.;policyname;policy.name;Text;None;;;;80;misc;policy_name;rsa.misc.policy_name;keyword
1;Identity;Source User Account;This key should only be used to capture the Secondary/Source User in the event;c_username;user.src;Text;None;none|-;;;77;identity;user_src;user.name;keyword
1;Miscellaneous;Process ID;This key is used to capture the Process ID, in case of parent child relationship, this can be used for child process id context.;process_id;process.id;Int64;Transient;(null)|-;process.id.val;process_id_val;75;misc;process_id;process.pid;long
1;;;;process;process;Text;None;;;;74;misc;process;process.name;keyword
1;Miscellaneous;Rule Name;This key captures the Rule Name;rulename;rule.name;Text;Transient;;;;72;misc;rule_name;rsa.misc.rule_name;keyword
1;Miscellaneous;Context;This key captures Information which adds additional context to the event.;context;context;Text;None;;;;70;misc;context;rsa.misc.context;keyword
1;Miscellaneous;Change New;This key is used to capture the new values of the attribute that’s changing in a session;change_new;change.new;Text;Transient;;;;69;misc;change_new;rsa.misc.change_new;keyword
1;Miscellaneous;Product Name;This key is used to capture the name of the product.;product;product;Text;Transient;;;;69;misc;product;observer.product;keyword
1;;;;space;;;;;;;68;misc;space;rsa.misc.space;keyword
1;Miscellaneous;Client Application;This key is used to capture only the name of the client application requesting resources of the server. See the user.agent meta key for capture of the specific user agent identifier or browser identification string.;agent;client;Text;None;;;;67;misc;client;rsa.misc.client;keyword
1;Time;Duration in seconds;This key is used to capture the normalized duration/lifetime in seconds.;duration;duration.time;Float64;None;;duration.str;duration_string;63;time;duration_time;rsa.time.duration_time;double
1;;;;msgIdPart1;;;;;;;63;misc;msgIdPart1;rsa.misc.msgIdPart1;keyword
1;Network;Network Service Name;This is used to capture layer 7 protocols/service names;network_service;network.service;Text;Transient;;;;62;network;network_service;rsa.network.network_service;keyword
1;File;Directory;This key is used to capture the file directory or path only;directory;directory;Text;None;;;;60;file;directory;file.directory;keyword
1;Network;Interface Generic;This key should be used when the source or destination context of an interface is not clear;interface;interface;Text;Transient;;;;60;network;interface;rsa.network.interface;keyword
1;;;;msgIdPart2;;;;;;;60;misc;msgIdPart2;rsa.misc.msgIdPart2;keyword
1;Miscellaneous;Change Old;This key is used to capture the old value of the attribute that’s changing in a session;change_old;change.old;Text;Transient;;;;59;misc;change_old;rsa.misc.change_old;keyword
1;Time;Event Time String;This key is used to capture the incomplete time mentioned in a session as a string;event_time_string;event.time.str;Text;Transient;;;;58;time;event_time_str;rsa.time.event_time_str;keyword
1;Reserved;Time;This is the time at which a session hits a NetWitness Decoder. This key should never be used to parse Meta data from a session (Logs/Packets) Directly, this is a Reserved key in NetWitness.;time;time;TimeT;Transient;;;;58;internal;time;rsa.internal.time;keyword
1;Network;Bytes Total;This key is the total number of Bytes sent/received in a session. Also, in cases where the Sent or Received context is not clear, this can be used.;bytes;bytes;UInt64;None;(null)|-;;;56;network;bytes;network.bytes;long
1;Network;Ethernet Source;This key should only be used when it’s a Source Mac Address.;smacaddr;eth.src;MAC;None;Unknown|Irresolvable;;;56;network;eth_src;source.mac;keyword
1;Miscellaneous;Operation Number;An alert number or operation number. The values should be unique and non-repeating.;operation_id;operation.id;Text;Transient;;;;56;misc;operation_id;rsa.misc.operation_id;keyword
1;Miscellaneous;Event State;This key captures the current state of the object/item referenced within the event. Describing an on-going event.;event_state;event.state;Text;None;;;;55;misc;event_state;rsa.misc.event_state;keyword
1;Network;Bytes Sent;This key should only be used to capture the size of Bytes Sent;sbytes;bytes.src;UInt64;None;(null)|-;;;53;network;bytes_src;source.bytes;long
1;;Network Port;Deprecated, use port. NOTE: There is a type discrepancy as currently used, TM: Int32, INDEX: UInt64 (why neither chose the correct UInt16?!);network_port;network.port;UInt64;None;(null);;;51;network;network_port;rsa.network.network_port;long
1;Network;Bytes Received;This key should only be used to capture the size of Bytes Received;rbytes;rbytes;UInt64;None;(null)|-;;;51;network;rbytes;destination.bytes;long
1;Time;Time Start;This key is used to capture the Start time mentioned in a session in a standard form;starttime;starttime;TimeT;None;;;;50;time;starttime;rsa.time.starttime;keyword
1;;;;uid;username;Text;None;none|-;;;50;identity;username;user.name;keyword
1;Miscellaneous;Action Event;This key is used to capture the primary action in a session;web_method;action;Text;None;;;;49;misc;action;rsa.misc.action;keyword
1;;;;month;;;;;;;49;time;month;rsa.time.month;keyword
1;Identity;Authentication Method;This key is used to capture authentication methods used only;authmethod;auth.method;Text;Transient;;;;46;identity;auth_method;rsa.identity.auth_method;keyword
1;;;;day;;;;;;;46;time;day;rsa.time.day;keyword
1;;;Deprecated key defined only in table map.;level;level;Int32;None;;;;45;internal;level;rsa.internal.level;integer
1;Miscellaneous;Group Object;This key captures a collection/grouping of entities. Specific usage;group_object;group.object;Text;Transient;;;;42;misc;group_object;rsa.misc.group_object;keyword
1;Miscellaneous;Node;Common use case is the node name within a cluster. The cluster name is reflected by the host name.;node;node;Text;Transient;;;;42;misc;node;rsa.misc.node;keyword
1;Miscellaneous;Rule Number;This key captures the Rule number;rule;rule;Text;Transient;;;;41;misc;rule;rsa.misc.rule;keyword
1;;Ethernet Host Address;Deprecated, use alias.mac;macaddr;eth.host;MAC;None;;;;39;network;eth_host;rsa.network.eth_host;keyword
1;Network;Source Interface;This key should only be used when it’s a Source Interface;sinterface;sinterface;Text;Transient;;;;39;network;sinterface;rsa.network.sinterface;keyword
1;Miscellaneous;Device Name;This is used to capture name of the Device associated with the node Like: a physical disk, printer, etc;device;device.name;Text;Transient;;;;38;misc;device_name;rsa.misc.device_name;keyword
1;Time;Event End time;This key is used to capture the End time mentioned in a session in a standard form;endtime;endtime;TimeT;Transient;;;;38;time;endtime;rsa.time.endtime;keyword
1;Miscellaneous;User Agent;This key captures the user agent identifier or the browser identification string. See the client meta key for the client application making the request.;user_agent;user.agent;Text;None;;;;37;misc;user_agent;user_agent.original;keyword
1;Reserved;Message ID;This is the Message ID1 value that identifies the exact log parser definition which parses a particular log session. This key should never be used to parse Meta data from a session (Logs/Packets) Directly, this is a Reserved key in NetWitness;msg_id;msg.id;Text;None;;;;36;internal;msg_id;rsa.internal.msg_id;keyword
1;Time;Time Zone;This key is used to capture the timezone of the Event Time;timezone;timezone;Text;None;;;;36;time;timezone;rsa.time.timezone;keyword
1;Miscellaneous;Parameter;This key is the parameters passed as part of a command or application, etc.;param;param;Text;None;;;;35;misc;param;rsa.misc.param;keyword
1;Email;Destination E-mail Address;This key is used to capture the Destination email address only, when the destination context is not clear use email;to;email.dst;Text;None;;;;34;email;email_dst;rsa.email.email_dst;keyword
1;Network;Ethernet Destination;This key should only be used when it’s a Destination Mac Address;dmacaddr;eth.dst;MAC;None;;;;34;network;eth_dst;destination.mac;keyword
1;Miscellaneous;Change Attribute;This key is used to capture the name of the attribute that’s changing in a session;change_attribute;change.attrib;Text;Transient;;;;33;misc;change_attrib;rsa.misc.change_attrib;keyword
1;Network;Traffic Flow Direction;This Key should never be used in a parser, this is a reserved key used by the product to calculate the direction.;direction;direction;Text;None;;;;33;network;direction;network.direction;keyword
1;Investigations;Event Categorization ID;This key captures the Event category number;event_cat;event.cat;UInt32;Transient;;;;33;investigations;event_cat;rsa.investigations.event_cat;integer
1;Investigations;Event Category Name;This key captures the event category name corresponding to the event cat code;event_cat_name;event.cat.name;Text;None;;;;33;investigations;event_cat_name;rsa.investigations.event_cat_name;keyword
1;Miscellaneous;Event Hostname;This key is a windows only concept, where this key is used to capture fully qualified domain name in a windows log.;event_computer;event.computer;Text;None;;;;33;misc;event_computer;rsa.misc.event_computer;keyword
1;Email;Source E-mail Address;This key is used to capture the source email address only, when the source context is not clear use email;from;email.src;Text;None;;;;32;email;email_src;rsa.email.email_src;keyword
1;Miscellaneous;Reference Id1;"This key is for Linked ID to be used as an addition to ""reference.id""";id1;reference.id1;Text;Transient;;;;32;misc;reference_id1;rsa.misc.reference_id1;keyword
1;;Translated Source Address;Deprecated, use ip.trans.src;stransaddr;stransaddr;Text;Transient;;;;32;network;stransaddr;source.nat.ip;ip
1;Reserved;Message ID1;This is the Message ID2 value that identifies the exact log parser definition which parses a particular log session. This key should never be used to parse Meta data from a session (Logs/Packets) Directly, this is a Reserved key in NetWitness;vid;msg.vid;Text;Transient;;;;31;internal;msg_vid;rsa.internal.msg_vid;keyword
1;;Privilege;Deprecated, use permissions;privilege;privilege;Text;Transient;;;;31;file;privilege;rsa.file.privilege;keyword
1;Identity;User Role;This key is used to capture the Role of a user only;user_role;user.role;Text;Transient;;;;31;identity;user_role;rsa.identity.user_role;keyword
1;Miscellaneous;Event Log Name;This key captures the Name of the event log;event_log;event.log;Text;Transient;;;;30;misc;event_log;rsa.misc.event_log;keyword
1;Web;FQDN;Fully Qualified Domain Names;fqdn;fqdn;Text;None;;;;29;web;fqdn;rsa.web.fqdn;keyword
1;;User Account;Deprecated, use user;administrator;username;Text;None;none|-;;;29;identity;username;user.name;keyword
1;;;;hostid;alias.host;Text;None;;;;28;network;alias_host;rsa.network.alias_host;keyword
1;;;Deprecated key defined only in table map.;data;data;Text;Transient;;;;28;internal;data;rsa.internal.data;keyword
1;Counters;Device class Counter 2;This is a generic counter key that should be used with the label dclass.c2.str only;dclass_counter2;dclass.c2;Int32;Transient;;;;28;counters;dclass_c2;rsa.counters.dclass_c2;integer
1;Network;Interface Destination;This key should only be used when it’s a Destination Interface;dinterface;dinterface;Text;Transient;;;;28;network;dinterface;rsa.network.dinterface;keyword
1;Miscellaneous;Operating System;This key captures the Name of the Operating System;os;OS;Text;None;;;;28;misc;OS;rsa.misc.OS;keyword
1;Web;Web page;The captures the web page information;webpage;web.page;Text;Transient;;;;28;web;web_page;http.response.body.content;keyword
1;Miscellaneous;Name of the Terminal;This key captures the Terminal Names only;terminal;terminal;Text;Transient;;;;27;misc;terminal;rsa.misc.terminal;keyword
1;;;;msgIdPart3;;;;;;;27;misc;msgIdPart3;rsa.misc.msgIdPart3;keyword
1;Miscellaneous;Filter;This key captures Filter used to reduce result set;filter;filter;Text;None;;;;26;misc;filter;rsa.misc.filter;keyword
1;Miscellaneous;Serial Number;This key is the Serial number associated with a physical asset.;serial_number;serial.number;Text;Transient;;;;26;misc;serial_number;rsa.misc.serial_number;keyword
1;Email;Subject;This key is used to capture the subject string from an Email only.;subject;subject;Text;None;;;;26;email;subject;rsa.email.subject;keyword
1;Identity;Domain OU;X.500 (LDAP) Distinguished Name;dn;dn;Text;None;;;;25;identity;dn;rsa.identity.dn;keyword
1;Time;Duration;A text string version of the duration;duration_string;duration.str;Text;Transient;;;;25;time;duration_str;rsa.time.duration_str;keyword
1;Database;Database instance name;This key is used to capture the database server instance name;instance;instance;Text;Transient;;;;25;db;instance;rsa.db.instance;keyword
1;;;;signame;policy.name;Text;None;;;;25;misc;policy_name;rsa.misc.policy_name;keyword
1;;;;web_query;query;Text;None;;;;25;web;query;url.query;keyword
1;;;;date;;;;;;;25;time;date;rsa.time.date;keyword
1;Identity;Logon Type;This key is used to capture the type of logon method used.;logon_type;logon.type;Text;None;;;;24;identity;logon_type;rsa.identity.logon_type;keyword
1;Web;Referer;This is used to capture the Web Referrer URL address specifically.;web_referer;referer;Text;None;None|-;;;24;web;referer;http.request.referrer;keyword
1;;Translated Destination Address;Deprecated, use ip.trans.dst;dtransaddr;dtransaddr;Text;Transient;;;;23;network;dtransaddr;destination.nat.ip;ip
1;Threat;Threat Category;This key captures Threat Name/Threat Category/Categorization of alert;threat_name;threat.category;Text;None;;;;23;threat;threat_category;rsa.threat.threat_category;keyword
1;Network;Vlan Number;This key should only be used to capture the ID of the Virtual LAN;vlan;vlan;UInt16;Transient;;vlan.name;vlan.name;23;network;vlan;rsa.network.vlan;integer
1;Miscellaneous;Checksum;This key is used to capture the checksum or hash of the entity such as a file or process. Checksum should be used over checksum.src or checksum.dst when it is unclear whether the entity is a source or target of an action.;checksum;checksum;Text;None;;;;22;misc;checksum;rsa.misc.checksum;keyword
1;Miscellaneous;Event User;This key is a windows only concept, where this key is used to capture combination of domain name and username in a windows log.;event_user;event.user;Text;None;;;;22;misc;event_user;rsa.misc.event_user;keyword
1;;;;year;;;;;;;22;time;year;rsa.time.year;keyword
1;Physical;Location;This is used to capture either the complete address or a description about a location being referenced in a session;location_desc;loc.desc;Text;Transient;;;;21;physical;loc_desc;geo.name;keyword
1;Miscellaneous;Virus Name;This key captures the name of the virus;virusname;virusname;Text;None;;;;21;misc;virusname;rsa.misc.virusname;keyword
1;Email;E-mail Address;This key is used to capture a generic email address where the source or destination context is not clear;user_address;email;Text;None;;;;20;email;email;rsa.email.email;keyword
1;File;File Size;This key is used to capture the size of the file only;filename_size;filename.size;Int32;None;(null)|-|N/A;;;20;file;filename_size;file.size;long
1;;Translated Source Port;Deprecated, use port.trans.src. NOTE: There is a type discrepancy as currently used, TM: Text, INDEX: UInt16;stransport;stransport;UInt16;Transient;;;;20;network;stransport;source.nat.port;long
1;Miscellaneous;Content Type;This key is used to capture Content Type only.;content_type;content.type;Text;Transient;;;;19;misc;content_type;rsa.misc.content_type;keyword
1;Database;Database Name;This key is used to capture the name of a database or an instance as seen in a session;db_name;database;Text;Transient;;;;19;db;database;rsa.db.database;keyword
1;;Translated Destination Port;Deprecated, use port.trans.dst. NOTE: There is a type discrepancy as currently used, TM: Text, INDEX: UInt16;dtransport;dtransport;UInt16;Transient;;;;19;network;dtransport;destination.nat.port;long
1;Miscellaneous;Group ID;This key captures Group ID Number (related to the group name);groupid;group.id;Text;Transient;;;;19;misc;group_id;rsa.misc.group_id;keyword
1;Miscellaneous;Policy ID;This key is used to capture the Policy ID only, this should be a numeric value, use policy.name otherwise;policy_id;policy.id;Text;Transient;;;;19;misc;policy_id;rsa.misc.policy_id;keyword
1;Cryptography;Cipher Name;This key is used to capture the Encryption Type or Encryption Key only;encryption_type;crypto;Text;Transient;;;;18;crypto;crypto;rsa.crypto.crypto;keyword
1;Time;Recorded time;The event time as recorded by the system the event is collected from. The usage scenario is a multi-tier application where the management layer of the system records it's own timestamp at the time of collection from its child nodes. Must be in timestamp format.;recorded_time;recorded.time;TimeT;Transient;;;;18;time;recorded_time;rsa.time.recorded_time;keyword
1;Miscellaneous;Virtual system name;This key captures Virtual System Name;vsys;vsys;Text;Transient;;;;18;misc;vsys;rsa.misc.vsys;keyword
1;Web;Web request Domain;This key captures Domain name in the Web Request;web_domain;web.domain;Text;Transient;;;;18;web;web_domain;url.domain;keyword
1;Miscellaneous;Connection ID;This key captures the Connection ID;connectionid;connection.id;Text;Transient;;;;17;misc;connection_id;rsa.misc.connection_id;keyword
1;Investigations;Vendor supplied Event Category;This is a vendor supplied category. This should be used in situations where the vendor has adopted their own event_category taxonomy.;vendor_event_cat;event.vcat;Text;Transient;;;;17;investigations;event_vcat;rsa.investigations.event_vcat;keyword
1;Miscellaneous;Packets Total;This key is the total number of packets sent/received in a session. Also, in cases where the Sent or Received context is not clear, this can be used.;packets;packets;UInt32;Transient;(null)|-;;;17;misc;packets;network.packets;long
1;;Parent Pid;Deprecated, use process.id.src;parent_pid;parent.pid;Int32;Transient;;parent.pid.val;parent_pid_val;17;misc;parent_pid;process.ppid;long
1;Identity;User Profile;This key is used to capture the user profile;profile;profile;Text;Transient;;;;17;identity;profile;rsa.identity.profile;keyword
1;Miscellaneous;Reference Id2;"This key is for the 2nd Linked ID. Can be either linked to ""reference.id"" or ""reference.id1"" value but should not be used unless the other two variables are in play.";id2;reference.id2;Text;Transient;;;;17;misc;reference_id2;rsa.misc.reference_id2;keyword
1;Miscellaneous;Sensor Name;This key captures Name of the sensor. Typically used in IDS/IPS based devices;sensor;sensor;Text;Transient;;;;17;misc;sensor;rsa.misc.sensor;keyword
