revision;Meta Class;Meta Concept;Meta Description;envisionName;nwName;format;flags;nullTokens;failureKey;failureMapping;nbOccurrences;shotMeta;name_noDot;ecsName;ecsType
1;Miscellaneous;Signature ID;This key captures IDS/IPS Int Signature ID;sigid;sig.id;Int32;None;(null);sig.id.str;sigid_string;17;misc;sig_id;rsa.misc.sig_id;integer
1;;;;logon_id;username;Text;None;none|-;;;17;identity;username;user.name;keyword
1;;;;datetime;;;;;;;17;time;datetime;rsa.time.datetime;keyword
1;Network;Zone Source;This key should only be used when it’s a Source Zone.;src_zone;zone.src;Text;Transient;;;;16;network;zone_src;rsa.network.zone_src;keyword
1;;;;user_fullname;fullname;Text;Transient;;;;15;identity;fullname;user.full_name;keyword
1;Miscellaneous;Port(Physical/Logical);This key is used for Physical or logical port connection but does NOT include a network port. (Example: Printer port name).;portname;port.name;Text;Transient;;;;15;misc;port_name;rsa.misc.port_name;keyword
1;Miscellaneous;Rule Group;This key captures the Rule group name;rule_group;rule.group;Text;Transient;;;;15;misc;rule_group;rsa.misc.rule_group;keyword
1;;;;owner;username;Text;None;none|-;;;15;identity;username;user.name;keyword
1;Wireless;WLAN Service Set Identifier;This key is used to capture the ssid of a Wireless Session;ssid;wlan.ssid;Text;Transient;;;;15;wireless;wlan_ssid;rsa.wireless.wlan_ssid;keyword
1;Network;Zone Generic;This key should be used when the source or destination context of a Zone is not clear;zone;zone;Text;Transient;;;;15;network;zone;rsa.network.zone;keyword
1;Network;Zone Destination;This key should only be used when it’s a Destination Zone.;dst_zone;zone.dst;Text;Transient;;;;15;network;zone_dst;rsa.network.zone_dst;keyword
1;Identity;Accesses;This key is used to capture actual privileges used in accessing an object;accesses;accesses;Text;None;;;;14;identity;accesses;rsa.identity.accesses;keyword
1;Network;Gateway;This key is used to capture the IP Address of the gateway;gateway;gateway;Text;Transient;;;;14;network;gateway;rsa.network.gateway;keyword
1;Miscellaneous;Risk Number;This key captures a Numeric Risk value;risk_num;risk.num;Float64;None;;;;14;misc;risk_num;rsa.misc.risk_num;double
1;Miscellaneous;Trigger Value;This key captures the Value of the trigger or threshold condition.;trigger_val;trigger.val;Text;Transient;;;;14;misc;trigger_val;rsa.misc.trigger_val;keyword
1;Cryptography;Source (Server) Cipher;This key is for Source (Client) Cipher;s_cipher;cipher.src;Text;Transient;;;;13;crypto;cipher_src;rsa.crypto.cipher_src;keyword
1;Network;ICMP Type;This key is used to capture the ICMP type only;icmptype;icmp.type;UInt32;Transient;;;;13;network;icmp_type;rsa.network.icmp_type;integer
1;Miscellaneous;Linked (Related) Session ID;This key is used to capture a Linked (Related) Session ID from the session directly;sessionid1;log.session.id1;Text;Transient;;;;13;misc;log_session_id1;rsa.misc.log_session_id1;keyword
1;;;Deprecated key defined only in table map.;obj_server;obj.server;Text;Transient;;;;13;internal;obj_server;rsa.internal.obj_server;keyword
1;Threat;Threat Description;This key is used to capture the threat description from the session directly or inferred;threat_val;threat.desc;Text;None;;;;13;threat;threat_desc;rsa.threat.threat_desc;keyword
1;Web;Web Cookie;This key is used to capture the Web cookies specifically.;web_cookie;web.cookie;Text;Transient;;;;13;web;web_cookie;rsa.web.web_cookie;keyword
1;Web;Root URLPath;This key captures the root URL path;web_root;web.root;Text;Transient;;;;13;web;web_root;url.path;keyword
1;;;;web_host;alias.host;Text;None;;;;12;web;alias_host;rsa.web.alias_host;keyword
1;Miscellaneous;Sub component Version;This key captures the Version level of a sub-component of a product.;component_version;comp.version;Text;Transient;;;;12;misc;comp_version;rsa.misc.comp_version;keyword
1;Miscellaneous;Content Version;This key captures Version level of a signature or database content.;content_version;content.version;Text;Transient;;;;12;misc;content_version;rsa.misc.content_version;keyword
1;Counters;Event Counter;This is used to capture the number of times an event repeated;event_counter;event.counter;Int32;Transient;;;;12;counters;event_counter;rsa.counters.event_counter;integer
1;Miscellaneous;Hardware/Serial ID;This key is used to capture unique identifier for a device or system (NOT a Mac address);hardware_id;hardware.id;Text;Transient;;;;12;misc;hardware_id;rsa.misc.hardware_id;keyword
1;Network;Network mask Generic;This key is used to capture the device network IPmask.;mask;mask;Text;Transient;;;;12;network;mask;rsa.network.mask;keyword
1;Miscellaneous;Risk;This key captures the non-numeric risk value;risk;risk;Text;Transient;;;;12;misc;risk;rsa.misc.risk;keyword
1;;;;event_id;;;;;;;12;misc;event_id;rsa.misc.event_id;keyword
1;;;;reason;;;;;;;12;misc;reason;rsa.misc.reason;keyword
1;;;;status;;;;;;;12;misc;status;rsa.misc.status;keyword
1;Counters;Device class Ratio 1;This is a generic ratio key that should be used with the label dclass.r1.str only;dclass_ratio1;dclass.r1;Text;Transient;;;;11;counters;dclass_r1;rsa.counters.dclass_r1;keyword
1;;Destination Domain;Deprecated, use domain.dst;ddomain;ddomain;Text;Transient;;;;11;network;ddomain;destination.domain;keyword
1;File;File Type;This key is used to capture the type of file only;filetype;filetype;Text;Transient;;;;11;file;filetype;file.type;keyword
1;Network;ICMP Code;This key is used to capture the ICMP code only;icmpcode;icmp.code;UInt32;Transient;;;;11;network;icmp_code;rsa.network.icmp_code;integer
1;Miscellaneous;Mailbox ID/Name;This key is used to capture the mailbox id/name;mail_id;mail.id;Text;Transient;;;;11;misc;mail_id;rsa.misc.mail_id;keyword
1;Identity;Realm;Radius realm or similar grouping of accounts;realm;realm;Text;Transient;;;;11;identity;realm;rsa.identity.realm;keyword
1;;;;sdomain;sdomain;Text;Transient;;;;11;network;sdomain;source.domain;keyword
1;Identity;Destination User Session ID;This key captures Destination User Session ID;sid;user.sid.dst;Text;Transient;;;;11;identity;user_sid_dst;rsa.identity.user_sid_dst;keyword
1;Cryptography;Certificate Subject;This key is used to capture the Certificate organization only;cert_subject;cert.subject;Text;None;;;;10;crypto;cert_subject;rsa.crypto.cert_subject;keyword
1;Counters;Device class Counter 3;This is a generic counter key that should be used with the label dclass.c3.str only;dclass_counter3;dclass.c3;Int32;Transient;;;;10;counters;dclass_c3;rsa.counters.dclass_c3;integer
1;Storage;Disk Volume;A unique name assigned to logical units (volumes) within a physical disk;disk_volume;disk.volume;Text;Transient;;;;10;storage;disk_volume;rsa.storage.disk_volume;keyword
1;Web;Reputation Number;Reputation Number of an entity. Typically used for Web Domains;reputation_num;reputation.num;Float64;Transient;None|-|ns|n/a|Risk unknown;;;10;web;reputation_num;rsa.web.reputation_num;double
1;Wireless;Access Point;This key is used to capture the access point name.;access_point;access.point;Text;None;;;;9;wireless;access_point;rsa.wireless.access_point;keyword
1;Counters;Device class Counter 1 Description;This is a generic counter string key that should be used with the label dclass.c1 only;dclass_counter1_string;dclass.c1.str;Text;Transient;;;;9;counters;dclass_c1_str;rsa.counters.dclass_c1_str;keyword
1;Identity;Distinguished Name Source;An X.500 (LDAP) Distinguished name that is used in a context that indicates a Source dn;src_dn;dn.src;Text;Transient;;;;9;identity;dn_src;rsa.identity.dn_src;keyword
1;Cryptography;Encryption peer's IP Address;This key is for Encryption peer's IP Address;peer;peer;Text;Transient;;;;9;crypto;peer;rsa.crypto.peer;keyword
1;Network;Protocol Detail;This key should be used to capture additional protocol information;protocol_detail;protocol.detail;Text;Transient;;;;9;network;protocol_detail;rsa.network.protocol_detail;keyword
1;Miscellaneous;Rule Unique ID;This key is the Unique Identifier for a rule.;rule_uid;rule.uid;Text;Transient;;;;9;misc;rule_uid;rsa.misc.rule_uid;keyword
1;;Source Domain;Deprecated, use domain.src;c_domain;sdomain;Text;Transient;;;;9;network;sdomain;source.domain;keyword
1;Miscellaneous;Trigger Description;This key captures the Description of the trigger or threshold condition.;trigger_desc;trigger.desc;Text;Transient;;;;9;misc;trigger_desc;rsa.misc.trigger_desc;keyword
1;;;;host;;;;;;;9;network;host;host.name;keyword
1;;;;inout;;;;;;;9;misc;inout;rsa.misc.inout;keyword
1;;;;p_msgid;;;;;;;9;misc;p_msgid;rsa.misc.p_msgid;keyword
1;;Child Pid;Deprecated, use process.id;child_pid;child.pid;Int32;Transient;;child.pid.val;child_pid_val;8;misc;child_pid;process.pid;long
1;Physical;Source Country;This is used to capture Source Country;location_src;country.src;Text;None;;;;8;physical;country_src;source.geo.country_name;keyword
1;Network;Network mask Destination;This key is used for Destionation Device network mask;dmask;dmask;Text;Transient;;;;8;network;dmask;rsa.network.dmask;keyword
1;Time;Event Effective time;This key is the effective time referenced by an individual event in a Standard Timestamp format;effective_time;effective.time;TimeT;Transient;;;;8;time;effective_time;rsa.time.effective_time;keyword
1;Network;Source IPv6 Address;This key should only be used when it’s a Source IP v6 Address;saddr_v6;ipv6.src;IPv6;None;(null)|-;host.src;shost;8;network;ipv6_src;source.ip;ip
1;Network;Port Generic;This key should only be used to capture a Network Port when the directionality is not clear;port;port;UInt16;None;;;;8;network;port;rsa.network.port;integer
1;;;;process_src;process.src;Text;Transient;;;;8;misc;process_src;process.parent.name;keyword
1;Network;Network mask Source;This key is used for capturing source Network Mask;smask;smask;Text;Transient;;;;8;network;smask;rsa.network.smask;keyword
1;Database;SQL Transaction ID;This key captures the SQL transantion ID of the current session;trans_id;transact.id;Text;Transient;;;;8;db;transact_id;rsa.db.transact_id;keyword
1;Web;Web referer Domain;Web referer's domain;web_ref_domain;web.ref.domain;Text;Transient;;;;8;web;web_ref_domain;rsa.web.web_ref_domain;keyword
1;;;;data_type;;;;;;;8;misc;data_type;rsa.misc.data_type;keyword
1;;;;msgIdPart4;;;;;;;8;misc;msgIdPart4;rsa.misc.msgIdPart4;keyword
1;Cryptography;Source (Server) Cipher size;This key captures Source (Client) Cipher Size;s_ciphersize;cipher.size.src;Int32;Transient;;;;7;crypto;cipher_size_src;rsa.crypto.cipher_size_src;integer
1;Physical;Destination Country;This is used to capture Destination Country;location_dst;country.dst;Text;None;;;;7;physical;country_dst;destination.geo.country_name;keyword
1;Miscellaneous;Errors;This key captures All non successful Error codes or responses;error;error;Text;Transient;;;;7;misc;error;rsa.misc.error;keyword
1;Time;Expiration time;This key is the timestamp that explicitly refers to an expiration.;expiration_time;expire.time;TimeT;Transient;;expire.time.str;expiration_time_string;7;time;expire_time;rsa.time.expire_time;keyword
1;Cryptography;IKE Negotiation Phase;IKE negotiation phase.;ike;ike;Text;Transient;;;;7;crypto;ike;rsa.crypto.ike;keyword
1;;;;index;index;Text;Transient;;;;7;misc;index;rsa.misc.index;keyword
1;Miscellaneous;Listnum;This key is used to capture listname or listnumber, primarily for collecting access-list;listnum;listnum;Text;Transient;;;;7;misc;listnum;rsa.misc.listnum;keyword
1;Physical;Country name;This is used to capture the Country Name when the Source/Destination Context is not clear, as seen in a session.;location_country;loc.country;Text;Transient;;;;7;physical;loc_country;geo.country_name;keyword
1;Storage;Logical Unit Number;Logical Unit Number.This key is a very useful concept in Storage.;lun;lun;Text;Transient;;;;7;storage;lun;rsa.storage.lun;keyword
1;;;Deprecated key defined only in table map.;obj_value;obj.val;Text;Transient;;;;7;internal;obj_val;rsa.internal.obj_val;keyword
1;Identity;Organization;This key captures the User organization;user_org;org;Text;Transient;;;;7;identity;org;rsa.identity.org;keyword
1;;;Deprecated key defined only in table map.;resource;resource;Text;Transient;;;;7;internal;resource;rsa.internal.resource;keyword
1;Cryptography;Encryption scheme used;This key captures the Encryption scheme used;scheme;scheme;Text;Transient;;;;7;crypto;scheme;rsa.crypto.scheme;keyword
1;;;;service_account;username;Text;None;none|-;;;7;identity;username;user.name;keyword
1;;;;ntype;;;;;;;7;misc;ntype;rsa.misc.ntype;keyword
1;Identity;Distinguished Name Destination;An X.500 (LDAP) Distinguished name that used in a context that indicates a Destination dn;dst_dn;dn.dst;Text;Transient;;;;6;identity;dn_dst;rsa.identity.dn_dst;keyword
1;Identity;Domain ID;This key captures Pre Windows 2000 (NetBIOS) name of the domain ONLY;domain_id;domain.id;Text;Transient;;;;6;identity;domain_id;user.domain;keyword
1;Identity;First name of a Person;This key is for First Names only, this is used for Healthcare predominantly to capture Patients information;user_fname;firstname;Text;Transient;;;;6;identity;firstname;rsa.identity.firstname;keyword
1;Identity;Last name of a Person;This key is for Last Names only, this is used for Healthcare predominantly to capture Patients information;user_lname;lastname;Text;Transient;;;;6;identity;lastname;rsa.identity.lastname;keyword
1;Miscellaneous;Observed Value;This key captures the Value observed (from the perspective of the device generating the log).;observed_val;observed.val;Text;Transient;;;;6;misc;observed_val;rsa.misc.observed_val;keyword
1;Miscellaneous;Policy Contents;This key captures the contents of the policy. This contains details about the policy;policy_value;policy.value;Text;Transient;;;;6;misc;policy_value;rsa.misc.policy_value;keyword
1;Miscellaneous;Pool Name;This key captures the name of a resource pool;pool_name;pool.name;Text;Transient;;;;6;misc;pool_name;rsa.misc.pool_name;keyword
1;Miscellaneous;Source Process ID;This key is used to capture the Source Process ID, in case of parent child relationship, this can be used for parent process id context;process_id_src;process.id.src;Int64;Transient;(null)|-;process.src;process_src;6;misc;process_id_src;process.ppid;long
1;Miscellaneous;Rule Template;A default set of parameters which are overlayed onto a rule (or rulename) which efffectively constitutes a template;rule_template;rule.template;Text;Transient;;;;6;misc;rule_template;rsa.misc.rule_template;keyword
1;;;;count;;;;;;;6;misc;count;rsa.misc.count;keyword
1;;;;number;;;;;;;6;misc;number;rsa.misc.number;keyword
1;;;;sigcat;;;;;;;6;misc;sigcat;rsa.misc.sigcat;keyword
1;;;;type;;;;;;;6;misc;type;rsa.misc.type;keyword
1;;;;r_hostid;alias.host;Text;None;;;;5;network;alias_host;rsa.network.alias_host;keyword
1;Miscellaneous;Comments;Comment information provided in the log message;comments;comments;Text;Transient;;;;5;misc;comments;rsa.misc.comments;keyword
1;Miscellaneous;DNS Query Type;This key is used to capture the DNS Query type only;dns_querytype;dns.querytype;Text;Transient;;;;5;misc;dns_querytype;dns.question.type;keyword
1;Miscellaneous;Document/File number;This key captures File Identification number;doc_number;doc.number;Int32;Transient;;;;5;misc;doc_number;rsa.misc.doc_number;integer
1;;;;cc;email;Text;None;;;;5;email;email;rsa.email.email;keyword
1;Miscellaneous;Expected Value;This key captures the Value expected (from the perspective of the device generating the log).;expected_val;expected.val;Text;Transient;;;;5;misc;expected_val;rsa.misc.expected_val;keyword
1;Network;Destination IPv6 address;This key should only be used when it’s a Destination IP v6 Address.;daddr_v6;ipv6.dst;IPv6;None;(null)|-;host.dst;dhost;5;network;ipv6_dst;destination.ip;ip
1;Miscellaneous;Job Number;This key captures the Job Number;jobnum;job.num;Text;Transient;;;;5;misc;job_num;rsa.misc.job_num;keyword
1;;;Deprecated key defined only in table map.;obj_id;obj.id;Text;Transient;;;;5;internal;obj_id;rsa.internal.obj_id;keyword
1;Cryptography;Encryption peer’s identity;This key is for Encryption peer’s identity;peer_id;peer.id;Text;Transient;;;;5;crypto;peer_id;rsa.crypto.peer_id;keyword
1;Database;Permissions;This key captures permission or privilege level assigned to a resource.;permissions;permissions;Text;Transient;(null)|-;;;5;db;permissions;rsa.db.permissions;keyword
1;;Process Time;Deprecated, use duration.time;processing_time;process.time;Text;Transient;;;;5;time;process_time;rsa.time.process_time;keyword
1;Cryptography;Encryption scheme used;This key captures the Signature Type;sigtype;sig.type;Text;Transient;;;;5;crypto;sig_type;rsa.crypto.sig_type;keyword
1;Miscellaneous;Destination SPI Index;Destination SPI Index;dst_spi;spi.dst;Text;Transient;;;;5;misc;spi_dst;rsa.misc.spi_dst;keyword
1;Miscellaneous;Source SPI Index;Source SPI Index;src_spi;spi.src;Text;Transient;;;;5;misc;spi_src;rsa.misc.spi_src;keyword
1;;;Deprecated key defined only in table map.;statement;statement;Text;Transient;;;;5;internal;statement;rsa.internal.statement;keyword
1;Identity;User's Department;User's Department Names only;user_dept;user.dept;Text;Transient;;;;5;identity;user_dept;rsa.identity.user_dept;keyword
1;Identity;Source User Session ID;This key captures Source User Session ID;c_sid;user.sid.src;Text;Transient;;;;5;identity;user_sid_src;rsa.identity.user_sid_src;keyword
1;Web;Web referer query;This key captures Web referer's query portion of the URL;web_ref_query;web.ref.query;Text;Transient;;;;5;web;web_ref_query;rsa.web.web_ref_query;keyword
1;Wireless;WLAN frequency channel;This is used to capture the channel names;wifi_channel;wlan.channel;UInt16;Transient;;;;5;wireless;wlan_channel;rsa.wireless.wlan_channel;integer
1;;;;bssid;wlan.ssid;Text;Transient;;;;5;wireless;wlan_ssid;rsa.wireless.wlan_ssid;keyword
1;;;;cert_issuer;;;;;;;5;crypto;cert_issuer;rsa.crypto.cert_issuer;keyword
1;;;;code;;;;;;;5;misc;code;rsa.misc.code;keyword
1;;;;method;;;;;;;5;web;method;http.request.method;keyword
1;;;;remote_domain;;;;;;;5;web;remote_domain;rsa.web.remote_domain;keyword
1;Miscellaneous;Agent Id;This key is used to capture agent id;agent.id;agent.id;Text;None;;;;4;misc;agent_id;rsa.misc.agent_id;keyword
1;;;Deprecated key defined only in table map.;cert_hostname;cert.host.name;Text;Transient;;;;4;crypto;cert_host_name;rsa.crypto.cert_host_name;keyword
1;Network;IP Address Originating;This is used to capture the original systems IPv4 address in case of a Forwarding Agent or a Proxy in between.;ip.orig;ip.orig;IPv4;None;;ipv6.orig;ipv6.orig;4;network;ip_orig;network.forwarded_ip;ip
1;Physical;City name;This is used to capture the CIty Name when the Source/Destination Context is not clear, as seen in a session. There is a separate key for GeoIP based City;location_city;loc.city;Text;Transient;;;;4;physical;loc_city;geo.city_name;keyword
1;Miscellaneous;Message Body;This key captures the The contents of the message body.;message_body;message.body;Text;Transient;;;;4;misc;message_body;rsa.misc.message_body;keyword
1;;;;calling_to;phone;Text;Transient;;;;4;misc;phone;rsa.misc.phone;keyword
1;Miscellaneous;Signature String;This key captures a string object of the sigid variable.;sigid_string;sig.id.str;Text;Transient;;;;4;misc;sig_id_str;rsa.misc.sig_id_str;keyword
1;Database;Table Name;This key is used to capture the table name;tbl_name;table.name;Text;Transient;;;;4;db;table_name;rsa.db.table_name;keyword
1;;;;c_user_name;;;;;;;4;identity;c_user_name;user.name;keyword
1;;;;cmd;;;;;;;4;misc;cmd;rsa.misc.cmd;keyword
1;;;;misc;;;;;;;4;misc;misc;rsa.misc.misc;keyword
1;;;;name;;;;;;;4;misc;name;rsa.misc.name;keyword
1;;;;web_ref_host;alias.host;Text;None;;;;3;network;alias_host;rsa.network.alias_host;keyword
1;;;Deprecated key defined only in table map.;audit_class;audit.class;Text;Transient;;;;3;internal;audit_class;rsa.internal.audit_class;keyword
1;Cryptography;Certificate Error String;This key captures the Certificate Error String;cert_error;cert.error;Text;Transient;;;;3;crypto;cert_error;rsa.crypto.cert_error;keyword
1;Cryptography;Destination (Server) Cipher;This key is for Destination (Server) Cipher;d_cipher;cipher.dst;Text;Transient;;;;3;crypto;cipher_dst;rsa.crypto.cipher_dst;keyword
1;Cryptography;Destination (Server) Cipher size;This key captures Destination (Server) Cipher Size;d_ciphersize;cipher.size.dst;Int32;Transient;;;;3;crypto;cipher_size_dst;rsa.crypto.cipher_size_dst;integer
1;Miscellaneous;CPU Time;This key is the CPU time used in the execution of the event being recorded.;cpu;cpu;UInt32;Transient;(null)|-;;;3;misc;cpu;rsa.misc.cpu;integer
1;Database;Database ID;This key is used to capture the unique identifier for a database;db_id;db.id;Text;Transient;;;;3;db;db_id;rsa.db.db_id;keyword
1;Database;Database server Process ID;This key captures the process id of a connection with database server;db_pid;db.pid;Int32;Transient;;;;3;db;db_pid;rsa.db.db_pid;integer
1;;;Deprecated key defined only in table map.;entry;entry;Text;Transient;;;;3;internal;entry;rsa.internal.entry;keyword
1;Miscellaneous;Event Description;This key is used to capture a description of an event available directly or inferred;detail;event.desc;Text;None;;;;3;misc;event_desc;rsa.misc.event_desc;keyword
1;Identity;Federated Service Provider;This key is the Federated Service Provider. This is the application requesting authentication.;federated_sp;federated.sp;Text;Transient;;;;3;identity;federated_sp;rsa.identity.federated_sp;keyword
1;Network;Network Name;This key is used to capture the network name associated with an IP range. This is configured by the end user.;netname;netname;Text;Transient;;;;3;network;netname;rsa.network.netname;keyword
1;;Device Address;Deprecated;paddr;paddr;IPv4;None;(null)|-;paddr.host;;3;network;paddr;rsa.network.paddr;ip
1;Miscellaneous;Phone;This is used to capture the Phone Number or a Calling station ID;calling_from;phone;Text;Transient;;;;3;misc;phone;rsa.misc.phone;keyword
1;Miscellaneous;Process;This key is used to capture the Process Name, in case of parent child relationship, this can be used for child process name context.;child_process;process;Text;None;;;;3;misc;process;process.name;keyword
1;Miscellaneous;Source Process Name;This key is used to capture the Source Proccess Name, in case of parent child relationship, this can be used for parent process name context;parent_process;process.src;Text;Transient;;;;3;misc;process_src;process.parent.name;keyword
1;Miscellaneous;Linked Signature ID;This key captures IDS/IPS Int Signature ID. This must be linked to the sig.id;sigid1;sig.id1;Int32;Transient;;;;3;misc;sig_id1;rsa.misc.sig_id1;integer
1;;SSL Source Version;Deprecated, use version;s_sslver;ssl.ver.src;Text;Transient;;;;3;crypto;ssl_ver_src;rsa.crypto.ssl_ver_src;keyword
1;;;Deprecated key defined only in table map.;trans_from;trans.from;Text;Transient;;;;3;email;trans_from;rsa.email.trans_from;keyword
1;Web;Web Referrer page;This key captures Web referer's page information;web_ref_page;web.ref.page;Text;Transient;;;;3;web;web_ref_page;rsa.web.web_ref_page;keyword
1;Web;Web referer Root URLPath;Web referer's root URL path;web_ref_root;web.ref.root;Text;Transient;;;;3;web;web_ref_root;rsa.web.web_ref_root;keyword
1;Wireless;WLAN name/number;This key captures either WLAN number/name;wlan;wlan.name;Text;Transient;;;;3;wireless;wlan_name;rsa.wireless.wlan_name;keyword
1;;;;d_certauth;;;;;;;3;crypto;d_certauth;rsa.crypto.d_certauth;keyword
1;;;;faddr;;;;;;;3;network;faddr;rsa.network.faddr;keyword
1;;;;hour;;;;;;;3;time;hour;rsa.time.hour;keyword
1;;;;im_buddyid;;;;;;;3;misc;im_buddyid;rsa.misc.im_buddyid;keyword
1;;;;im_client;;;;;;;3;misc;im_client;rsa.misc.im_client;keyword
1;;;;im_userid;;;;;;;3;misc;im_userid;rsa.misc.im_userid;keyword
1;;;;lhost;;;;;;;3;network;lhost;rsa.network.lhost;keyword
1;;;;min;;;;;;;3;time;min;rsa.time.min;keyword
1;;;;origin;;;;;;;3;network;origin;rsa.network.origin;keyword
1;;;;pid;;;;;;;3;misc;pid;rsa.misc.pid;keyword
1;;;;priority;;;;;;;3;misc;priority;rsa.misc.priority;keyword
1;;;;remote_domain_id;;;;;;;3;network;remote_domain_id;rsa.network.remote_domain_id;keyword
1;;;;s_certauth;;;;;;;3;crypto;s_certauth;rsa.crypto.s_certauth;keyword
1;;;;timestamp;;;;;;;3;time;timestamp;rsa.time.timestamp;keyword
1;;;;urldomain;;;;;;;3;web;urldomain;url.domain;keyword
1;File;Attachment;This key captures the attachment file name;attachment;attachment;Text;None;;;;2;file;attachment;rsa.file.attachment;keyword
1;Miscellaneous;Context Subject;This key is to be used in an audit context where the subject is the object being identified;s_context;context.subject;Text;Transient;;;;2;misc;context_subject;rsa.misc.context_subject;keyword
1;;;;t_context;context.target;Text;Transient;;;;2;misc;context_target;rsa.misc.context_target;keyword
1;Miscellaneous;CVE;This key captures CVE (Common Vulnerabilities and Exposures) - an identifier for known information security vulnerabilities.;cve;cve;Text;Transient;;;;2;misc;cve;rsa.misc.cve;keyword
1;Counters;Device class Counter 2 Description;This is a generic counter string key that should be used with the label dclass.c2 only;dclass_counter2_string;dclass.c2.str;Text;Transient;;;;2;counters;dclass_c2_str;rsa.counters.dclass_c2_str;keyword
1;Counters;Device class Ratio 1 Description;This is a generic ratio string key that should be used with the label dclass.r1 only;dclass_ratio1_string;dclass.r1.str;Text;Transient;;;;2;counters;dclass_r1_str;rsa.counters.dclass_r1_str;keyword
1;Counters;Device class Ratio 2;This is a generic ratio key that should be used with the label dclass.r2.str only;dclass_ratio2;dclass.r2;Text;Transient;;;;2;counters;dclass_r2;rsa.counters.dclass_r2;keyword
1;Time;Event Queing Time;This key is the Time that the event was queued.;event_queue_time;event.queue.time;TimeT;Transient;;;;2;time;event_queue_time;rsa.time.event_queue_time;keyword
